### ISSUE TITLE
DATV controller v0.3.141592653   No transmit

### ISSUE THREAD

**Issue by computer-wizard** [F5OEO/tezuka_fw#394]
PlutoSDR with latest Tezuka  v0.3.141592653  at Ubuntu 24.04

I have no transmit output with the DATV controller in Tezuka.

It is set to address 239.0.0.1  port 5004  and OBS  also and the proper DVB settings , I see the udp packets going in OBS when I click record.
(Monitored with tcpdump. )

(TX in the DATV contoller is ON)

When I ssh to the Pluto and check with netstat I see the following open UDP ports,

# netstat -an | grep -i udp
udp        0      0 0.0.0.0:5353            0.0.0.0:*                           
udp        0      0 127.0.0.1:323           0.0.0.0:*                           
udp        0      0 0.0.0.0:67              0.0.0.0:*                           
udp        0      0 :::5353                 :::*      

Port 5004 is not listed!

Transmitter is working when I use the signal generator in Tezuka

**Comment by F5OEO** [comment]
Here is what I have when dvbs2-ts on : 
 netstat -an | grep -i udp
udp        0      0 0.0.0.0:5353            0.0.0.0:*
udp        0      0 127.0.0.1:1004          0.0.0.0:*
udp        0      0 0.0.0.0:60989           0.0.0.0:*
udp        0      0 127.0.0.1:323           0.0.0.0:*
udp        0      0 0.0.0.0:67              0.0.0.0:*
udp        0      0 0.0.0.0:45125           0.0.0.0:*
udp        0      0 0.0.0.0:45145           0.0.0.0:*
udp        0      0 0.0.0.0:41582           0.0.0.0:*
udp        0      0 0.0.0.0:111             0.0.0.0:*
udp        0      0 44.0.0.2:123            0.0.0.0:*
udp        0      0 10.0.0.55:123           0.0.0.0:*
udp        0      0 127.0.0.1:123           0.0.0.0:*
udp        0      0 0.0.0.0:123             0.0.0.0:*
udp        0      0 0.0.0.0:57787           0.0.0.0:*
udp   473088      0 230.0.0.2:1234          0.0.0.0:*
udp        0      0 230.10.0.1:1234         0.0.0.0:*
udp        0      0 :::5353                 :::*
udp        0      0 ::1:323                 :::*
udp        0      0 :::44905                :::*
udp        0      0 :::111                  :::*
udp        0      0 :::123                  :::*
udp        0      0 :::41108                :::*
udp        0      0 :::37018                :::*
udp        0      0 :::47800                :::*
udp        0      0 :::52926                :::*
#

**Comment by computer-wizard** [comment]
Yes, I see same if I plugin the LibreSDR instead of the Pluto but also with that SDR, no transmit on DATV :-(

**Comment by F5OEO** [comment]
There is no DATV on pluto boards..only 7020 fpga boards.

**Comment by computer-wizard** [comment]
OK, I understand about the Pluto.  I'm now using the LibreSDR with the 7020 and I don't have any output with that

OBS Output set for udp://230.10.0.1:1234  -> push record
DATV controller set to 230.10.0.1:1234 ->  Frequency set for 438 MHz DVB-S2/TS parameters set and  tx ptt pushed what is red.

No power output or modulation.

tx works when tested with the signal generator in Tezuka

Is there anything I can monitor from the Linux shell in the LibreSDR?

Boudewijn VE3TOK

**Comment by computer-wizard** [comment]
I tried to listen from inside LibreSDR Linux's prompt with  netcat at   230.10.0.1:1234 as tcpdump is not avalable

# nc -lk -u 230.10.0.1 1234

But nothing is coming in at that multicast address and port  

At Ubuntu at what Obs is running and on what the Tezuka DATV Controller Web page (In Firefox) is opened
I see the multicast packets:

13:23:11.369146 IP 192.168.0.46.48769 > 230.10.0.1.1234: UDP, length 1472
13:23:11.369158 IP 192.168.0.46.48769 > 230.10.0.1.1234: UDP, length 1472
13:23:11.369166 IP 192.168.0.46.48769 > 230.10.0.1.1234: UDP, length 1472
13:23:11.369171 IP 192.168.0.46.48769 > 230.10.0.1.1234: UDP, length 96
13:23:11.369180 IP 192.168.0.46.48769 > 230.10.0.1.1234: UDP, length 564

73,
Boudwijn VE3TOK

**Comment by F5OEO** [comment]
Your setup is not good ;
Set your websocket server on your PC

<img width="887" height="814" alt="Image" src="https://github.com/user-attachments/assets/88bb0671-cbc5-49ab-ab10-08982a9c6c99" />

On dashboard , leave the udp : 230.10.0.1:1234

<img width="1645" height="819" alt="Image" src="https://github.com/user-attachments/assets/5d71b879-881d-4590-91d1-a26e28beee90" />

On OBS Controller, set ip of obs machine and password

<img width="1244" height="325" alt="Image" src="https://github.com/user-attachments/assets/644842d9-e2b0-42fe-ab83-7e8bf7f5cbd3" />

**Comment by computer-wizard** [comment]
My setup in OBS  is good,  I discovered  that I can't use netcat  to monitor for those packets but when I monitor 
/proc/net/dev/  I can see that multicast packets are coming in the LibreSDR but not at what port of course.

What I understand from others is that the transmitter can be switched on from DATV controller to give an carrier even when incoming UDP packets are not send.  That doesn't happen here and that is what I don't understand.  
I will try the websocket server and see how that works out.

Thanks Evariste,

Boudewijn VE3TOK

**Comment by computer-wizard** [comment]
Hello Avariste

OBS configured for Web sockets.

I see in the command shell that the Websocket client communicates with the Websocket server in OBS

In Terzuka's OBS encoder I see, 'Not in a DVB-S / DVB-S2 stream mode' and not 'Auto sent'.
When I set in  DATV controller the stream mode to DVBS2/TS  and go back to OBS Encoder I still see: ' Not in a DVB-S / DVB-S2 stream mode'

When I go back to DATV controller the stream mode is back to 'Passthrough', it doesn't hold!
That is the status, still no transmit :-(

I'm confused about the Signal Generator settings because I think or it looks like there is a relation with 'DATV Controller' as I have
to set the frequency there  otherwise it doesn't hold the frequency in DATV controller.

Also has Service to be on in the Signal Generator windows for DATV to be work and what about  tx on/off setting in that window for DATV?

73,

Boudewijn VE3TOK

**Comment by F5OEO** [comment]
Signal generator is a completely other part and these 2 modes are exclusive. If you have still signal generator engaged and try datv, it will crash the main datv process, and never recover. That's why if it revert to passtrrough, it is not goot. Need to reboot.

**Comment by computer-wizard** [comment]
Understood about Signal generator

I still see   'Not in a DVB-S / DVB-S2 stream mode' in OBS encoder

<img width="1407" height="386" alt="Image" src="https://github.com/user-attachments/assets/9e883e0a-3240-43db-a9fc-3069f3f7a7e6" />

**Comment by computer-wizard** [comment]
And no transmit and with switch between OBS encoder and DATV controller it still goes to Passthrough stream mode and frequency falls back to what was set in 'Signal generator' (What is switched off!)

**Comment by F5OEO** [comment]
Seems that pluto_stream process which should hanlde the dvb was crashed.
Can you ssh to libre, see if pluto_stream is running.
If it is up, kill it and lanch it, we will see the messages and where it crash.
If you have mqttexplorer, you should see regular messages from /dt/pluto/VE3TOK/..

<img width="1029" height="739" alt="Image" src="https://github.com/user-attachments/assets/917b0b40-dcdc-44d1-b7ab-90fa4b751dbc" />

**Comment by computer-wizard** [comment]
It seems the problem is when I'm only using USB as I don't see the problem with Ethernet, at least not anymore (version: 0.3.141592653)
When using USB,

# ps ax | grep pluto
 1278 root     /usr/bin/pluto_mqtt_ctrl
 1279 root     /usr/bin/pluto_stream
 5472 root     grep pluto
# kill 1279
# ps ax | grep pluto
 1278 root     /usr/bin/pluto_mqtt_ctrl
 6255 root     grep pluto
#  /usr/bin/pluto_stream
KeyRoot VE3TOK
Tx thread Started
Try to Change txmode 0
Change txmode 0
No iface eth0
IP address: 192.168.2.1
RTNETLINK answers: File exists
[AdaptiveModCod] init fec=1/4 (idx=0) bps/sym=2 Rs=750ksps cap_max=1350kbps

It seems that it is expecting interface eth0 to be used instead of interface usb0 when I restart pluto_stream.

**Comment by computer-wizard** [comment]
Well today the problems are also back when I run it over Ethernet :-(

When I restart pluto_stream  it doesn't see the call.

## Error: "call" not defined
KeyRoot nocall
Tx thread Started
Try to Change txmode 0
Change txmode 0
IP address: 192.168.0.21
## Error: "call" not defined
[AdaptiveModCod] init fec=1/4 (idx=0) bps/sym=2 Rs=750ksps cap_max=1350kbps

The call is clear defined at the webpage.

**Comment by computer-wizard** [comment]
Hi Evariste.

I upgraded to the latest firmware v0.3.141592653589 and that has the same issue, no tx with DVB, restarting pluto_stream doesn't help,
Only once  I had this release working with Tezuka switching record in OBS on and off all the time.
Still no call when it doesn't transmit, below is a snapshot of MQTT-Explorer when that happens although the PTT is engaged and DVBS2 is set and Tezuka sets OBS to record. I can find no error in the logs of Tezuka as far as I can see. 

<img width="1026" height="749" alt="Image" src="https://github.com/user-attachments/assets/41621b28-779a-47a0-a279-f7e8e521e291" />

73,

Boudewijn VE3TOK

**Comment by computer-wizard** [comment]
Problem resolved with new version
